{
  "schema_version": "0.2.0",
  "otp_id": "f52df05a-f182-4b8c-819a-74f83b7a5603",
  "created_at": "2026-07-02T13:52:15.568Z",
  "updated_at": "2026-07-02T13:52:15.568Z",
  "disclosure_tier": "profile",
  "name": {
    "given": "Giacomo",
    "family": "Tüfekçi",
    "display": "Giacomo Tüfekçi"
  },
  "title": "Full-Stack Developer",
  "location": {
    "country": "DE",
    "city": "Ludwigshafen am Rhein",
    "region": "Rheinland-Pfalz"
  },
  "availability": "immediate",
  "work_model": [
    "remote",
    "hybrid",
    "onsite"
  ],
  "salary_band": {
    "min": 30000,
    "max": 60000,
    "currency": "EUR",
    "period": "annual"
  },
  "skills": [
    {
      "name": "AJAX",
      "level": 5
    },
    {
      "name": "AMPHP",
      "level": 5
    },
    {
      "name": "Bootstrap",
      "level": 5
    },
    {
      "name": "CSS",
      "level": 5
    },
    {
      "name": "CSS3",
      "level": 5
    },
    {
      "name": "CakePHP",
      "level": 5
    },
    {
      "name": "Canvas",
      "level": 5
    },
    {
      "name": "Chai",
      "level": 5
    },
    {
      "name": "Composer",
      "level": 5
    },
    {
      "name": "Contao",
      "level": 5
    },
    {
      "name": "Drupal",
      "level": 5
    },
    {
      "name": "ES6+",
      "level": 5
    },
    {
      "name": "Ember.js",
      "level": 5
    },
    {
      "name": "Gulp",
      "level": 5
    },
    {
      "name": "HTML",
      "level": 5
    },
    {
      "name": "HTML5",
      "level": 5
    },
    {
      "name": "Handlebars",
      "level": 5
    },
    {
      "name": "JSON",
      "level": 5
    },
    {
      "name": "Javascript",
      "level": 5
    },
    {
      "name": "Joomla",
      "level": 5
    },
    {
      "name": "Laravel",
      "level": 5
    },
    {
      "name": "Less",
      "level": 5
    },
    {
      "name": "Magento",
      "level": 5
    },
    {
      "name": "MongoDB",
      "level": 5
    },
    {
      "name": "Mustache",
      "level": 5
    },
    {
      "name": "MySQL",
      "level": 5
    },
    {
      "name": "NoSQL",
      "level": 5
    },
    {
      "name": "NodeJS",
      "level": 5
    },
    {
      "name": "OOP",
      "level": 5
    },
    {
      "name": "PHP5",
      "level": 5
    },
    {
      "name": "PHP7",
      "level": 5
    },
    {
      "name": "PHP8",
      "level": 5
    },
    {
      "name": "PHPUnit",
      "level": 5
    },
    {
      "name": "PhalconPHP",
      "level": 5
    },
    {
      "name": "Preact",
      "level": 5
    },
    {
      "name": "Purecss",
      "level": 5
    },
    {
      "name": "REST",
      "level": 5
    },
    {
      "name": "React",
      "level": 5
    },
    {
      "name": "ReactPHP",
      "level": 5
    },
    {
      "name": "Responsive Design",
      "level": 5
    },
    {
      "name": "Sass",
      "level": 5
    },
    {
      "name": "Shopware",
      "level": 5
    },
    {
      "name": "Slim",
      "level": 5
    },
    {
      "name": "Solid",
      "level": 5
    },
    {
      "name": "Svelte",
      "level": 5
    },
    {
      "name": "SvelteKit",
      "level": 5
    },
    {
      "name": "TestCafe",
      "level": 5
    },
    {
      "name": "TypeScript",
      "level": 5
    },
    {
      "name": "Typo3",
      "level": 5
    },
    {
      "name": "Vite",
      "level": 5
    },
    {
      "name": "WebGL",
      "level": 5
    },
    {
      "name": "WebRTC",
      "level": 5
    },
    {
      "name": "WebSockets",
      "level": 5
    },
    {
      "name": "WebAssembly",
      "level": 5
    },
    {
      "name": "Webpack",
      "level": 5
    },
    {
      "name": "WooCommerce",
      "level": 5
    },
    {
      "name": "Wordpress",
      "level": 5
    },
    {
      "name": "XML",
      "level": 5
    },
    {
      "name": "jQuery",
      "level": 5
    },
    {
      "name": "npm",
      "level": 5
    },
    {
      "name": "phpBB",
      "level": 5
    },
    {
      "name": "Android",
      "level": 5
    },
    {
      "name": "API",
      "level": 5
    },
    {
      "name": "API Design",
      "level": 5
    },
    {
      "name": "Browser Automation",
      "level": 5
    },
    {
      "name": "C#",
      "level": 5
    },
    {
      "name": "C++",
      "level": 5
    },
    {
      "name": "Cordova",
      "level": 5
    },
    {
      "name": "Dart",
      "level": 5
    },
    {
      "name": "Design Patterns",
      "level": 5
    },
    {
      "name": "Electron",
      "level": 5
    },
    {
      "name": "Flask",
      "level": 5
    },
    {
      "name": "GO",
      "level": 5
    },
    {
      "name": "Haxe",
      "level": 5
    },
    {
      "name": "Headless Browser",
      "level": 5
    },
    {
      "name": "IPFS",
      "level": 5
    },
    {
      "name": "Lua",
      "level": 5
    },
    {
      "name": "NodeWebkit",
      "level": 5
    },
    {
      "name": "Phonegap",
      "level": 5
    },
    {
      "name": "Puppeteer",
      "level": 5
    },
    {
      "name": "Python",
      "level": 5
    },
    {
      "name": "React Native",
      "level": 5
    },
    {
      "name": "Redis",
      "level": 5
    },
    {
      "name": "Rust",
      "level": 5
    },
    {
      "name": "Scripting",
      "level": 5
    },
    {
      "name": "Selenium",
      "level": 5
    },
    {
      "name": "SQL",
      "level": 5
    },
    {
      "name": "Unit Testing",
      "level": 5
    },
    {
      "name": "Visual Basic",
      "level": 5
    },
    {
      "name": "Version Control",
      "level": 5
    },
    {
      "name": "iOS",
      "level": 5
    },
    {
      "name": "Adobe Automation",
      "level": 4
    },
    {
      "name": "Adobe Script",
      "level": 4
    },
    {
      "name": "Avocode",
      "level": 4
    },
    {
      "name": "Blender",
      "level": 4
    },
    {
      "name": "Corporate Design",
      "level": 4
    },
    {
      "name": "Fireworks",
      "level": 4
    },
    {
      "name": "Flash",
      "level": 4
    },
    {
      "name": "Gimp",
      "level": 4
    },
    {
      "name": "Illustrator",
      "level": 4
    },
    {
      "name": "InDesign",
      "level": 4
    },
    {
      "name": "Photoshop",
      "level": 4
    },
    {
      "name": "Premiere",
      "level": 4
    },
    {
      "name": "Prototyping",
      "level": 4
    },
    {
      "name": "Sketch",
      "level": 4
    },
    {
      "name": "Spritely",
      "level": 4
    },
    {
      "name": "UI/UX Design",
      "level": 4
    },
    {
      "name": "Wireframing",
      "level": 4
    },
    {
      "name": "AWS",
      "level": 4
    },
    {
      "name": "Apache",
      "level": 4
    },
    {
      "name": "Asterisk",
      "level": 4
    },
    {
      "name": "Azure",
      "level": 4
    },
    {
      "name": "Bash",
      "level": 4
    },
    {
      "name": "CapRover",
      "level": 4
    },
    {
      "name": "Cron",
      "level": 4
    },
    {
      "name": "DNS",
      "level": 4
    },
    {
      "name": "Database Administration",
      "level": 4
    },
    {
      "name": "Docker",
      "level": 4
    },
    {
      "name": "Docker Compose",
      "level": 4
    },
    {
      "name": "Dockerfile",
      "level": 4
    },
    {
      "name": "E-Mail",
      "level": 4
    },
    {
      "name": "Linux",
      "level": 4
    },
    {
      "name": "Load Balancing",
      "level": 4
    },
    {
      "name": "Nginx",
      "level": 4
    },
    {
      "name": "OpenFaaS",
      "level": 4
    },
    {
      "name": "Podman",
      "level": 4
    },
    {
      "name": "Rancher",
      "level": 4
    },
    {
      "name": "Reverse Proxy",
      "level": 4
    },
    {
      "name": "SSH",
      "level": 4
    },
    {
      "name": "SSL/TLS",
      "level": 4
    },
    {
      "name": "Shell Scripting",
      "level": 4
    },
    {
      "name": "Swarm",
      "level": 4
    },
    {
      "name": "System Administration",
      "level": 4
    },
    {
      "name": "Unix",
      "level": 4
    },
    {
      "name": "Vagrant",
      "level": 4
    },
    {
      "name": "Windows",
      "level": 4
    },
    {
      "name": "MelonJS",
      "level": 3
    },
    {
      "name": "Unity3D",
      "level": 3
    },
    {
      "name": "Unreal",
      "level": 3
    },
    {
      "name": "WebGL / Canvas",
      "level": 3
    },
    {
      "name": "three.js",
      "level": 3
    },
    {
      "name": "Agile",
      "level": 4
    },
    {
      "name": "Bitbucket",
      "level": 4
    },
    {
      "name": "Code Review",
      "level": 4
    },
    {
      "name": "Confluence",
      "level": 4
    },
    {
      "name": "Discord",
      "level": 4
    },
    {
      "name": "Git",
      "level": 4
    },
    {
      "name": "GitHub",
      "level": 4
    },
    {
      "name": "GitLab",
      "level": 4
    },
    {
      "name": "Google Workspace",
      "level": 4
    },
    {
      "name": "Jira",
      "level": 4
    },
    {
      "name": "Microsoft Office",
      "level": 4
    },
    {
      "name": "Microsoft Teams",
      "level": 4
    },
    {
      "name": "Project Planning",
      "level": 4
    },
    {
      "name": "Slack",
      "level": 4
    },
    {
      "name": "Technical Project Management",
      "level": 4
    },
    {
      "name": "Trello",
      "level": 4
    },
    {
      "name": "ActionScript",
      "level": 3
    },
    {
      "name": "ActionScript 2.0",
      "level": 3
    },
    {
      "name": "AdobeScript",
      "level": 3
    },
    {
      "name": "CLI",
      "level": 3
    },
    {
      "name": "CMS",
      "level": 3
    },
    {
      "name": "CRM",
      "level": 3
    },
    {
      "name": "Connexus",
      "level": 3
    },
    {
      "name": "Crawler",
      "level": 3
    },
    {
      "name": "Database",
      "level": 3
    },
    {
      "name": "Database-Publishing",
      "level": 3
    },
    {